{"directions":{"DL":{"duration_samples":230400000,"events":[{"event_id":"baseline","kind":"set","sample_offset":0,"settings":{"cw_enabled":false,"cw_freq_hz":0.0,"cw_sir_db":0.0,"gain":1.0,"noise_enabled":false,"noise_snr_db":0.0}},{"event_id":"level-1","kind":"set","sample_offset":92160000,"settings":{"cw_enabled":false,"cw_freq_hz":0.0,"cw_sir_db":0.0,"gain":1.0,"noise_enabled":false,"noise_snr_db":0.0}},{"event_id":"level-2","kind":"set","sample_offset":103680000,"settings":{"cw_enabled":false,"cw_freq_hz":0.0,"cw_sir_db":0.0,"gain":1.0,"noise_enabled":false,"noise_snr_db":0.0}},{"event_id":"level-3","kind":"set","sample_offset":115200000,"settings":{"cw_enabled":false,"cw_freq_hz":0.0,"cw_sir_db":0.0,"gain":1.0,"noise_enabled":false,"noise_snr_db":0.0}},{"event_id":"restore","kind":"restore","sample_offset":126720000,"settings":{"cw_enabled":false,"cw_freq_hz":0.0,"cw_sir_db":0.0,"gain":1.0,"noise_enabled":false,"noise_snr_db":0.0}}]},"UL":{"duration_samples":230400000,"events":[{"event_id":"baseline","kind":"set","sample_offset":0,"settings":{"cw_enabled":false,"cw_freq_hz":0.0,"cw_sir_db":0.0,"gain":1.0,"noise_enabled":false,"noise_snr_db":0.0}},{"event_id":"level-1","kind":"set","sample_offset":92160000,"settings":{"cw_enabled":false,"cw_freq_hz":0.0,"cw_sir_db":0.0,"gain":1.0,"noise_enabled":true,"noise_snr_db":20.0}},{"event_id":"level-2","kind":"set","sample_offset":103680000,"settings":{"cw_enabled":false,"cw_freq_hz":0.0,"cw_sir_db":0.0,"gain":1.0,"noise_enabled":true,"noise_snr_db":10.0}},{"event_id":"level-3","kind":"set","sample_offset":115200000,"settings":{"cw_enabled":false,"cw_freq_hz":0.0,"cw_sir_db":0.0,"gain":1.0,"noise_enabled":true,"noise_snr_db":0.0}},{"event_id":"restore","kind":"restore","sample_offset":126720000,"settings":{"cw_enabled":false,"cw_freq_hz":0.0,"cw_sir_db":0.0,"gain":1.0,"noise_enabled":false,"noise_snr_db":0.0}}]}},"pipeline_id":"00000000-0000-0000-0000-000000000005","profile_sha256":"4850747e5d8609d6c0ad9ba71d331fba733c07bf62e5b897ce8610f43432e545","protocol_id":"gradual-noise-example-v1","qualification":"development_only","schema_version":"radio_broker_schedule_v1","study_id":"00000000-0000-0000-0000-000000000001","trial_id":"00000000-0000-0000-0000-000000000003"}
